{
  "$schema": "./expected-places.schema.json",
  "schemaVersion": 1,
  "trace": "car_a50_highway_110kmh",
  "scenario": "highway110",
  "status": "approved",
  "synthetic": true,
  "candidates": "candidates.json",
  "expectedMode": "Car",
  "mustTrigger": [
    {
      "place": "Repère autoroute important (test)",
      "reason": "importance 72"
    },
    {
      "place": "Repère autoroute visible (test)",
      "reason": "visible de la route"
    }
  ],
  "mustNotTrigger": [
    {
      "place": "Repère autoroute mineur (test)",
      "reason": "importance 40 et invisible"
    }
  ],
  "notes": "Trace synthétique (generate_synthetic.py) : attentes tirées des critères F-09 / F-10, pas d'un enregistrement de terrain."
}
